name,categories,price,rating,specification,image_link
BHM Germany Alexa,"['Bydlení a doplňky', 'Nábytek', 'Židle a stoličky', 'Kancelářské židle']",5029.0,95.0,"Kolečková kancelářská židle je neodmyslitelným příslušenstvím každého správně zařízeného pracovního místa. Patřičně tvarované části jsou zárukou naprosto pohodlného sezení. BHM GERMANY Alexa, oranžové nabízí synchronní variantu mechaniky. Opěrák a sedák jsou nastaveny vždy v ideální vzájemné poloze, tím je zaručena vhodná poloha pro velmi dlouhé sezení. Nechybí pevné područky pro vyšší komfort opřených rukou. Především při opravdu dlouhém dni v kanceláři je praktická hlavová opěrka. Díky ní ulevíte svalům na krku. Bolest zad způsobenou špatným posezem nedopustí bederní opěrka, která nutí ke správnému opírání. Hlavní vlastnosti kancelářské židle BHM GERMANY Alexa, oranžové Oranžová barva potahu kancelářské židle ozdobí interiér Nastavení sedáku a opěráku je společné díky synchronnímu systému Opřít se můžete o pevné područky Správné držení těla díky bederní opěrce Optimální sezení zajistí i hlavová opěrka Materiály potahů BHM GERMANY Alexa, oranžové: síťovinové Kancelářská židle BHM Germany má chromovaný...",https://im9.cz/iR/importprodukt-orig/071/07105d6e401c223ea883bf4983a92096--mmf350x350.jpg
SEDIA Q031,"['Bydlení a doplňky', 'Nábytek', 'Židle a stoličky', 'Kancelářské židle']",3879.0,,Křeslo Q031,https://im9.cz/iR/importprodukt-orig/241/241bc276de1c86bda1573ada2fab35ce--mmf350x350.jpg
Antares 1920 Alex Alu VIP,"['Bydlení a doplňky', 'Nábytek', 'Židle a stoličky', 'Kancelářské židle']",3532.0,100.0,Kancelářská židle 1920 Alex ALU,https://im9.cz/iR/importprodukt-orig/007/0075b1e1850278d063b80220882b2665--mmf350x350.jpg
Halmar President,"['Bydlení a doplňky', 'Nábytek', 'Židle a stoličky', 'Kancelářské židle']",7679.0,,Kancelářské křeslo President Halmar,https://im9.cz/iR/importprodukt-orig/208/2084dbfcc7760c8fe39431a42c38c598--mmf350x350.jpg
Kondela Van,"['Bydlení a doplňky', 'Nábytek', 'Židle a stoličky', 'Kancelářské židle']",3590.0,92.0,"Kancelářské židle Van, šedá Oblé tvary, měkké sezení a látka příjemné na dotyk této židle vás přímo obejme. Židle Van vám pro perný pracovní den poskytne potřebnou oporu těla a pohodlí. Neutrální design pak skvěle zapadne do kanceláře či pracovny. Čalounění tvoří pevná látka, která je prodyšná a příjemná na dotyk. Jednoduchá látka je na opěráku ozvláštněna o prošívání, které vytváří vlnky pro příjemnější opření zad. Barva látky je velice neutrální, tak aby byla co nejsnadněji kombinovatelná, a celá židle…",https://im9.cz/iR/importprodukt-orig/c6f/c6f1ac316a88290bef75e1cf909a15fe--mmf350x350.jpg
Ergodo Caroline,"['Bydlení a doplňky', 'Nábytek', 'Židle a stoličky', 'Kancelářské židle']",3080.0,94.0,Kancelářské křeslo ERGODO CAROLINE černé  ,https://im9.cz/iR/importprodukt-orig/5d1/5d1f157ab73371c7db3f14b4627d2f2b--mmf350x350.jpg
Sedia W118,"['Bydlení a doplňky', 'Nábytek', 'Židle a stoličky', 'Kancelářské židle']",1749.0,,Nosnost 100kg. Výběr provedení.,https://im9.cz/iR/importprodukt-orig/011/011dbc85fa39262c630c0592813b5ca4--mmf350x350.jpg
Sedia S157 Hogen,"['Bydlení a doplňky', 'Nábytek', 'Židle a stoličky', 'Kancelářské židle']",3090.0,,"Menší, příjemné, pojízdné, otočné, výškově nastavitelné kancelářské křeslo. Mírně tvarovaná zádová opěrka, zejména v oblasti beder i sedadlo jsou vyrobeny z kvalitní 100%  PU kůže. Jejich prostřední část je perforovaná, pro vzdušnost při sezení, což oceníte zejména v letních měsících. Pevné područky jsou vyrobeny z tvrzeného plastu v černé barvě a v daném potahu barvy křesla. Disponuje houpacím mechanismem celého korpusu s aretací pouze v základní poloze, s regulací tuhosti v závislosti na váze uživatele. Tuhost mechanismu se ovládá pomocí utahování a povolování šroubu umístěného pod sedákem. Výškové nastavení plynovým pístem. V základu černý, plastový kříž s černými koncovkami, které chrání proti poškrábání a plastové kolečka na koberec nebo linoleum. Kolečka lze za příplatek vyměnit za pogumovaná, vhodná na kachle, dřevěné a plovoucí podlahy. Pokud nebudete křeslo chtít pojízdné, ale spíše aby stálo na místě, můžete místo koleček zvolit kluzáky. Křeslo není příliš robustní, tudíž je vhodné i pro menší osoby. Využití v domácnostech, studentských pokojů i kanceláří s jednosměnným provozem, kde zcela splňuje požadavky pro zdravé sezení. Dodáváno v rozloženém stavu, v krabici. Montážní návod přiložen.",https://im9.cz/iR/importprodukt-orig/8ea/8ea0db1f894806e96a673116d62322fd--mmf350x350.jpg
Mayer Smarty 2416 02,"['Bydlení a doplňky', 'Nábytek', 'Židle a stoličky', 'Kancelářské židle']",5614.0,98.0,POPIS,https://im9.cz/iR/importprodukt-orig/964/964ae6f7393f11d27e2bd8766f2a6801--mmf350x350.jpg
Cassaredo Q-022,"['Bydlení a doplňky', 'Nábytek', 'Židle a stoličky', 'Kancelářské židle']",2781.0,88.0,"Otáčecí kancelářská židle - křeslo v moderním designu. Křeslo je vhodné do kanceláře, domácí pracovny či studentského pokoje.",https://im9.cz/iR/importprodukt-orig/1c8/1c8d8a93a7889cd8cc8503beb3781aba--mmf350x350.jpg
inSPORTline G-Chair Basic,"['Bydlení a doplňky', 'Nábytek', 'Židle a stoličky', 'Kancelářské židle']",3090.0,88.0,"Balónová židle inSPORTline G-Chair Basic je ideálním řešením pro všechny, kteří tráví dlouhé hodiny v sedě, ať už v práci za počítačem nebo doma. Sezení na gymnastickém míči nutí ke správnému držení středu těla (polohu pánve a páteře), což vede k vzpřímenému posedu. Zároveň dochází k neustálému udržování rovnováhy, při kterém se zapojují hluboké stabilizační svaly.",https://im9.cz/iR/importprodukt-orig/787/787ae4931f597a1ddfd0b63d1f2f51f5--mmf350x350.jpg
Sedia Duck,"['Bydlení a doplňky', 'Nábytek', 'Židle a stoličky', 'Kancelářské židle']",3213.0,85.0,"Moderní, pojízdné, otočné, výškově nastavitelné kancelářské křeslo. Zádové opěradlo je tvarované v horní části i v oblasti beder a je vyrobené z kvalitní 100% PU kůže. Taktéž i sedadlo je z PU kůže. Pevné područky jsou vyrobeny z tvrzeného plastu v barvě odstínu šedé a v daném potahu barvy křesla. Disponuje houpacím mechanismem celého korpusu s aretací pouze v základní poloze, s regulací tuhosti v závislosti na váze uživatele. Tuhost mechanismu se ovládá pomocí utahování a povolování šroubu umístěného pod sedákem. Výškové nastavení plynovým pístem. V základu tvrzený, plastový kříž s černými koncovkami, které chrání proti poškrábání a plastové kolečka na koberec nebo linoleum. Kolečka lze za příplatek vyměnit za pogumovaná, vhodná na kachle, dřevěné a plovoucí podlahy. Pokud nebudete křeslo chtít pojízdné, ale spíše aby stálo na místě, můžete místo koleček zvolit kluzáky. Vhodná do domácností i kanceláří s jednosměnným provozem, kde zcela splňuje požadavky pro zdravé sezení. Dodáváno v rozloženém stavu, v krabici. Montážní návod přiložen.",https://im9.cz/iR/importprodukt-orig/67d/67d9e17b0cb0e0e18ccbb57552beae66--mmf350x350.jpg
Signal Q-031,"['Bydlení a doplňky', 'Nábytek', 'Židle a stoličky', 'Kancelářské židle']",3703.0,98.0,Kancelářské křeslo Q-031 šedé,https://im9.cz/iR/importprodukt-orig/13d/13d0344fc6ba7319824e972420b6bced--mmf350x350.jpg
Halmar Vire 2,"['Bydlení a doplňky', 'Nábytek', 'Židle a stoličky', 'Kancelářské židle']",1760.0,98.0,Kancelářská židle VIRE 2 šedá,https://im9.cz/iR/importprodukt-orig/29a/29ad92a3b3c8e30c03a69339b4d816d1--mmf350x350.jpg
Antares Flexible,"['Bydlení a doplňky', 'Nábytek', 'Židle a stoličky', 'Kancelářské židle']",10821.0,96.0, ,https://im9.cz/iR/importprodukt-orig/0ea/0eaa6aef54da496fcde37d9b311a9a30--mmf350x350.jpg
Kovo Praktik Milano II,"['Bydlení a doplňky', 'Nábytek', 'Židle a stoličky', 'Kancelářské židle']",2118.0,94.0,"Pracovní židle Milano II s područkami je skvělou volbou do průmyslových oblastí, zejména pak do montážních hal k pracovním linkám. Můžete ji však bez problému využívat také v běžných kancelářích. Židle je vybavena pístem pro výškové nastavení a i díky vestavěným plastovým područkám zajistí při práci vždy pohodlné sezení. Židle disponuje také opěrákem, který vytvoří oporu zad při delším sezení a uleví vám od bolesti. Opěrák je stejně jako sedák čalouněn do příjemné látky, která je odolná proti prodření a snadno se udržuje. O stabilitu se postará pevný kříž, který je stejně jako celá konstrukce židle vyroben z odolného plastu. Standardně židli dodáváme s kolečky pro měkké podlahy. Místo nich si však můžete dokoupit kluzáky, které zabraňují pohybu a zajistí vám větší stabilitu. Nosnost pracovní židle Milano II s područkami je 100 kg a dodáváme ji ve čtyřech barevných provedeních. V zelené, modré, červené a šedé barvě. Hlavní přednosti pracovní židle Milano II Ideální židle do průmyslových oblastí a montážních hal Výškové nastavení zaručí vždy pohodlné sezení Sedák i opěrák jsou čalouněny do odolné látky Stabilitu zajistí pevný plastový kříž Nosnost židle Milano II s područkami je 100 kg",https://im9.cz/iR/importprodukt-orig/08e/08e28188ce434cb651332e37f5b13238--mmf350x350.jpg
Kondela Taxis,"['Bydlení a doplňky', 'Nábytek', 'Židle a stoličky', 'Kancelářské židle']",3390.0,92.0,Kancelářská židle TAXIS zelená/ bílá,https://im9.cz/iR/importprodukt-orig/0eb/0eb979ddc17f18862e8a4dfc5cd71bf5--mmf350x350.jpg
Kondela Elmas,"['Bydlení a doplňky', 'Nábytek', 'Židle a stoličky', 'Kancelářské židle']",2030.0,92.0,Křeslo ELMAS se řídí heslem pohodlí nade vše,https://im9.cz/iR/importprodukt-orig/04e/04e11c4d2f0ea957d8c941207a186403--mmf350x350.jpg
Halmar Rubin,"['Bydlení a doplňky', 'Nábytek', 'Židle a stoličky', 'Kancelářské židle']",4090.0,92.0,"Moderní kancelářské křeslo je sportovní křeslo, které vyniká velice elegantním a neotřelým designem. Hlavní předností křesla je především velmi pohodlné sezení.",https://im9.cz/iR/importprodukt-orig/46b/46b0f39dcf0eaeaf0602eae931c9fb26--mmf350x350.jpg
Tectake Mike,"['Bydlení a doplňky', 'Nábytek', 'Židle a stoličky', 'Kancelářské židle']",1919.0,87.0,"První řada ergonomicky tvarované závodní kancelářské židle od tectake se zakřívenými liniemi a pohodlným čalouněním. Prodyšná síťová vložka proti pocení odvádí vlhkost, při práci nebo hraní. Robustní základna otočné židle zaručí vysokou pevnost a stabilitu, zatímco dvojitá kolečka odolná proti oděru hladce kloužou po podlaze. Použité plasty dodávají konstrukci dlouhou životnost. Závodní kancelářské židle od tectake Vám poskytnou jedinečný zážitek ze sezení.",https://im9.cz/iR/importprodukt-orig/a80/a8018fb1289a4864598ffc1cbd47f63f--mmf350x350.jpg
Kondela Laira,"['Bydlení a doplňky', 'Nábytek', 'Židle a stoličky', 'Kancelářské židle']",2840.0,94.0,"Kancelářské křeslo LAIRA je designovým skvostem, který ulahodí nejen oku, ale potěší především vaše tělo",https://im9.cz/iR/importprodukt-orig/067/0674922db981c90dfafb1e624512110c--mmf350x350.jpg
Sedia Prezident II Q025,"['Bydlení a doplňky', 'Nábytek', 'Židle a stoličky', 'Kancelářské židle']",2110.0,85.0,Kancelářská židle Q025 Prezident II,https://im9.cz/iR/importprodukt-orig/000/00028dc482e2d2cc923ca351b8b2d253--mmf350x350.jpg
Mayer ACTIKID A2,"['Bydlení a doplňky', 'Nábytek', 'Židle a stoličky', 'Kancelářské židle']",6328.0,98.0,"ROSTOUCÍ ŽIDLE - ZÁKLAD DĚTSKÉHO POKOJE 2428 41 - 30 461 - AQUACLEAN červenošedá, šedá síťovina (50% Polyester / 35% Polyacryl / 15% Polyamid, otěruvzdornost 250.000 cyklů)  ",https://im9.cz/iR/importprodukt-orig/161/161d4c2c310887998044d2fbbbc6a305--mmf350x350.jpg
Halmar Stanley,"['Bydlení a doplňky', 'Nábytek', 'Židle a stoličky', 'Kancelářské židle']",2929.0,91.0,"Kancelářské křeslo je příjemně vypadající křeslo, které vyniká velice elegantním a stylovým designem. Díky tomu se hodí do domácích pracoven i do kanceláře.",https://img-cdn.heureka.group/v1/5ecab8ab-924a-4032-9967-a8292e422ba8.jpg?width=350&height=350
Sedia S238 Pilot,"['Bydlení a doplňky', 'Nábytek', 'Židle a stoličky', 'Kancelářské židle']",4138.0,98.0,"Střední, příjemné, pojízdné, otočné, výškově nastavitelné manažerské i herní kancelářské křeslo. Mírně tvarovaná zádová opěrka, zejména v oblasti beder i sedadlo jsou vyrobeny z kvalitní 100%  PU kůže (velmi odolná syntetická kůže). Jejich prostřední část je perforovaná, pro vzdušnost při sezení, což oceníte zejména v letních měsících. Další výhodou jsou výklopné područky z tvrzeného, černého plastu s imitací chromu a černé syntetické kůže, díky nim křeslo lépe zasunete ke stolu. Disponuje houpacím mechanismem celého korpusu s aretací pouze v základní poloze, s regulací tuhosti v závislosti na váze uživatele. Tuhost mechanismu se ovládá pomocí utahování a povolování šroubu umístěného pod sedákem. Výškové nastavení plynovým pístem. V základu plastový kříž s imitací chromu a černými koncovkami, které chrání proti poškrábání. Plastové kolečka na koberec nebo linoleum, které lze za příplatek vyměnit za pogumovaná, vhodná na kachle, dřevěné a plovoucí podlahy. Pokud nebudete křeslo chtít pojízdné, ale spíše aby stálo na místě, můžete místo koleček zvolit kluzáky. Využití v domácnostech, studentských pokojů i kanceláří s jednosměnným provozem, kde zcela splňuje požadavky pro zdravé sezení. Dodáváno v rozloženém stavu, v krabici. Montážní návod přiložen.",https://im9.cz/iR/importprodukt-orig/42d/42d34362ecc6fae507a111d099d0de43--mmf350x350.jpg
Mayer Sitzmöbel 2428 Actikid,"['Bydlení a doplňky', 'Nábytek', 'Židle a stoličky', 'Kancelářské židle']",6328.0,91.0,"ROSTOUCÍ ŽIDLE - ZÁKLAD DĚTSKÉHO POKOJE 2428 42 - 30 462 - AQUACLEAN modrošedá, šedá síťovina (50% Polyester / 35% Polyacryl / 15% Polyamid, otěruvzdornost 250.000 cyklů)  ",https://im9.cz/iR/importprodukt-orig/00e/00e5ac0d237c1fb4824b941703f6c559--mmf350x350.jpg
LD Seating Look 375-SYS,"['Bydlení a doplňky', 'Nábytek', 'Židle a stoličky', 'Kancelářské židle']",8833.0,98.0,Kancelářská židle LOOK 370-SYS (verze s podhlavníkem nahrazuje LOOK 375-SYS),https://im9.cz/iR/importprodukt-orig/8ac/8ac0788b85c0e86205f12e10e0c4b08e--mmf350x350.jpg
LD Seating Fly 710,"['Bydlení a doplňky', 'Nábytek', 'Židle a stoličky', 'Kancelářské židle']",20703.0,100.0,"Kolekce FLY je ucelenou řadou modelů zahrnující pracovní, konferenční i relaxační židle. Pro FLY charakteristická kombinace leštěného hliníku, chromované oceli a zajímavého perfektně provedeného čalounění propůjčuje židlím řady FLY atraktivní neotřelý vzhled. Široká paleta modelů různého typu v kombinaci se dvěma typy čalounění nabízí každému uživateli možnost výběru židle odpovídající jeho individuálním požadavkům, potřebám i estetickému cítění. Všechny židle řady Fly jsou vybaveny elegantními područkami z leštěného hliníku. Područky mohou být doplněny praktickým na dotek příjemným návlekem z kůže. Efektním doplňkem kříže z leštěného hliníku u otočných židlí jsou volitelná pryžová kolečka, jejichž tělo je odlito ze slitiny kovů a pochromováno.",https://im9.cz/iR/importprodukt-orig/57a/57a17bf246e9fc78a03e3836eeb9237c--mmf350x350.jpg
HJH Office Profondo,"['Bydlení a doplňky', 'Nábytek', 'Židle a stoličky', 'Kancelářské židle']",5999.0,96.0,"hjh OFFICE Kancelářská židle PROFONDO Na výšku po stupních nastavitelná ergonomická bederní podpěrka  Nastavení hloubky sedu jednou rukou Opěradlo vyrobeno z prodyšné síťoviny s integrovanou bederní podpěrkou Ergonomický synchronní mechanismus s velkým úhlem otevření; nastavitelný úhel opěrky ve 3 stupních, protitlak individuálně nastavitelný podle tělesné hmotnosti Uvolnění v oblasti ramen díky výškově nastavitelným loketním opěrkám Komfortní polstrované sedadlo s otěruvzdorným textilním potahem Hloubku sedáku lze nastavit snadněji než kdykoli předtím pomocí samostatné páky pod sedadlem - ideální pro dlouhé nohy Tvarovaná, leštěná hliníková konstrukce Kolečka vhodná na každou podlahu Kolečka se pohybují jen vlivem zatížení - bez zatížení jsou kolečka zabržděná Včetně příslušenství: multifunkční kolečka (cca 11 x 65 mm) Materiál 100 % polyester Rozměry cca 60 x 110 x 61 cm (Š x V x H) Hmotnost cca 15 kg",https://im9.cz/iR/importprodukt-orig/c26/c26e5d60d6c8c2d5682a6ad30ec8fc28--mmf350x350.jpg
Sedia 44,"['Bydlení a doplňky', 'Nábytek', 'Židle a stoličky', 'Kancelářské židle']",2432.0,100.0,Nosnost 120kg. Výběr potahu.,https://im9.cz/iR/importprodukt-orig/0c2/0c234ac53d3df13225d5cdae35102ba3--mmf350x350.jpg
Topstar Titan Junior,"['Bydlení a doplňky', 'Nábytek', 'Židle a stoličky', 'Kancelářské židle']",5270.0,98.0,Dětská židle TITAN Junior,https://im9.cz/iR/importprodukt-orig/141/14102b63760a667adca11fa515fec0c0--mmf350x350.jpg
Sedia W 952 SA-2738,"['Bydlení a doplňky', 'Nábytek', 'Židle a stoličky', 'Kancelářské židle']",2090.0,,Kancelářské křeslo SEDIA W 952,https://im9.cz/iR/importprodukt-orig/3bc/3bcd02e9923b3af1f1bf71ae9bedad85--mmf350x350.jpg
RIM Flexi FX 1104.087.022,"['Bydlení a doplňky', 'Nábytek', 'Židle a stoličky', 'Kancelářské židle']",9968.0,100.0,"Komfortní kancelářská židle FLEXI splňuje všechny požadavky kancelářského sezení.  Zaujme Vás svým vzhledem a komfortním sezením. Opěradlo má plastový rám potažený  šedou síťovinou s vysokou pevností, což zajišťuje dobrou podporu zad a cirkulaci vzduchu. Oporu v bederní části páteře tvoří bederní opěrka. Záhlavník je síťovaný výškově stavitelný a sklopný. Sedák židle  je čalouněný v šedé látce s vysokou otěruvzdorností s nastavením hloubky sedáku. Područky jsou výškově, šířkově a hloubkově nastavitelné. Plastový kříž má univerzální kolečka. Židle podporuje zdravé dynamické sezení díky moderní synchronní mechanice ST1 s komfortním bočním nastavením tuhosti. Mechanika této kancelářské židle zaručuje dokonalé pohodlí a ergonomii díky plynulému chodu a optimálnímu přizpůsobení se každému uživateli. Čalounění: látka Phoenix 595 šedá a síťovina RIB 432 šedá.",https://im9.cz/iR/importprodukt-orig/2cd/2cd2ff1628c697078a115d30e1e05918--mmf350x350.jpg
PROFim Xenon Net 101,"['Bydlení a doplňky', 'Nábytek', 'Židle a stoličky', 'Kancelářské židle']",8518.0,100.0,"Kancelářské otočné křeslo zaujme svým elegantně síťovaným opěrákem, který lze zvolit podle Vašich představ. Sedák křesla je čalouněný. Křeslo má synchronním mechanismus, který může být doplněný o posuv a náklon sedáku.  U křesla jsou také na výběr područky. Praktickým doplňkem je nastavitelná bederní opěrka. Elegantn&i",https://im9.cz/iR/importprodukt-orig/312/312f35ca173c369433bc52f035621a23--mmf350x350.jpg
MaYAH Spirit,"['Bydlení a doplňky', 'Nábytek', 'Židle a stoličky', 'Kancelářské židle']",5285.0,100.0,"Židle s charakterem! Inovace, která se Vám bude líbit, komfortní mechanismus přizpůsobující se tělesné hmotnosti, sklopné područky a kovový kříž.",https://im9.cz/iR/importprodukt-orig/0b8/0b8dc9036bcc9256a39c91ccc447fc33--mmf350x350.jpg
Antares Texas multi,"['Bydlení a doplňky', 'Nábytek', 'Židle a stoličky', 'Kancelářské židle']",4270.0,88.0,Antares Texas multi,https://im9.cz/iR/importprodukt-orig/0bb/0bb946399eea9278c7098bcf726762bf--mmf350x350.jpg
Mayer Acticid A2 2428 49,"['Bydlení a doplňky', 'Nábytek', 'Židle a stoličky', 'Kancelářské židle']",6328.0,100.0,"ROSTOUCÍ ŽIDLE - ZÁKLAD DĚTSKÉHO POKOJE 2428 49 - 30 370 - AQUACLEAN růžovošedá, šedá síťovina (50% Polyester / 35% Polyacryl / 15% Polyamid, otěruvzdornost 250.000 cyklů)  ",https://im9.cz/iR/importprodukt-orig/422/422e943f757e6bf5915c5a5f896689a0--mmf350x350.jpg
LD Seating Stream 285-SY,"['Bydlení a doplňky', 'Nábytek', 'Židle a stoličky', 'Kancelářské židle']",9063.0,100.0,Kancelářská židle STREAM 280-SY,https://im9.cz/iR/importprodukt-orig/20e/20e79a63eb179eb35933ea04396f2f3a--mmf350x350.jpg
B2B Partner Winston SAB,"['Bydlení a doplňky', 'Nábytek', 'Židle a stoličky', 'Kancelářské židle']",15470.0,96.0, ,https://im9.cz/iR/importprodukt-orig/100/100d46d699b838dc0817c3acf9b5eff9--mmf350x350.jpg
Euroseat Alex,"['Bydlení a doplňky', 'Nábytek', 'Židle a stoličky', 'Kancelářské židle']",4425.0,96.0,Příjemný látkový potah zajišťující pohodlí!,https://im9.cz/iR/importprodukt-orig/16f/16f0d6413c899626d13c7564b32a2c6e--mmf350x350.jpg
Sedia Q118,"['Bydlení a doplňky', 'Nábytek', 'Židle a stoličky', 'Kancelářské židle']",2790.0,,Židle Q118 šedá,https://im9.cz/iR/importprodukt-orig/612/612615b086b0312d28df08379aeaf91a--mmf350x350.jpg
Antares 1580 Syn Gala Alu,"['Bydlení a doplňky', 'Nábytek', 'Židle a stoličky', 'Kancelářské židle']",7132.0,100.0,POPIS,https://im9.cz/iR/importprodukt-orig/258/258b58bccc6472864283c9f3e5cadc89--mmf350x350.jpg
Mayer Actikid,"['Bydlení a doplňky', 'Nábytek', 'Židle a stoličky', 'Kancelářské židle']",6565.0,90.0,Dětská židle ACTIKID 2428 A2  ,https://im9.cz/iR/importprodukt-orig/77e/77e3e33b2d9b9dfb21e743cccc16a81a--mmf350x350.jpg
Kovonax Minidelta plus,"['Bydlení a doplňky', 'Nábytek', 'Židle a stoličky', 'Kancelářské židle']",13674.0,98.0,"MINIDELTA PLUS je otočné křeslo, které disponuje výškovým nastavením. Je čalouněné do lékařské koženky, nebo do potahové látky v mnoha barevných odstínech. Maximální nosnost křesla je 150 kg. Područky masivní buk s možností moření. Křeslo možno osadit kluzáky nebo kolečky.",https://im9.cz/iR/importprodukt-orig/551/551c1ef18f77db9327abf032f6fe1d75--mmf350x350.jpg
Idea Monaco,"['Bydlení a doplňky', 'Nábytek', 'Židle a stoličky', 'Kancelářské židle']",1699.0,94.0,"Kancelářská židle křeslo MONACO je otočná a výškově nastavitelná kancelářská židle bez područek. Byl kladen velký důraz na použité materiály a kvalitu zpracování. Možnost výběru barevného provedení v barvách červená, modrá, zelená, černá.",https://im9.cz/iR/importprodukt-orig/142/142e72d992549eda9f7a7194aab17819--mmf350x350.jpg
Unique Ares Mesh,"['Bydlení a doplňky', 'Nábytek', 'Židle a stoličky', 'Kancelářské židle']",8090.0,92.0,"- Nastavení výšky sedadla - Sedák a opěrka hlavy jsou pokryty kvalitní látkou - Opěradlo z vysoce kvalitního textilního pletiva propustného pro vzduch. - deformační mechanismus SYNCHRON - umožňuje zastavit opěradlo v jedné z pěti poloh nebo volně klouzat - Nastavitelné područky (nahoru) - Područky vyrobené z měkkého a příjemného materiálu. - Hnací základna ze silného plastu (nylon) - 2 roky záruka - Maximální zatížení 130 kg - Hmotnost 22 kg - Odolnost vůči oděru - 140 000 cyklů Martindale Informace o producentovi jedinečný Mateřská společnost Unique je výrobcem prvotřídního nábytku. Unikátní značka je na trhu k dispozici již řadu let. Během této doby neustále staví standardy spotřebitelských služeb a usiluje o dokonalost v každé z nabízených židlí. V rozsáhlé paletě produktů dominuje kancelářské vybavení, jehož zástupci jsou otočné židle, křesla a komplexní kancelářské vybavení. Unikátní zaměření na kvalitu a spolehlivost, díky čemuž nabízí pouze čestně vyrobené zboží vyrobené z materiálů vysoké elegance. Kromě toho se jedinečný kancelářský nábytek vyznačuje příjemným poplatkem, který může konkurovat nejdůležitějším dodavatelům zařízení na domácím trhu. Každá z vás, která hledá jedinečný nábytek pro vaši kancelář, ocení trvanlivost a úžasné estetické hledisko poskytované vyráběnými kontejnery, plechy z plechu a pevnými systémy křesel a sedadel, dále policemi a jiným nábytkem. Díky použití testovaných výstupů mají jedinečné produkty hladkou a spolehlivou pozici po celou dobu používání. Při rozhodování o vybavení od jedinečné nabídky si můžete být jisti spokojeností uzavřených výrobků, které uspokojí chutě nejnáročnějších lidí, pro něž jsou v získaných zařízeních rozhodující pohodlí, bezpečnost a elegantní vzhled. Vyhledat také ... Vyhledat podobné výrobky v kategoriích: Kancelářské židle , Otočné židle (Kancelář) , Křesla a otočné židle (Office) , Jedinečné (Výrobci)",https://im9.cz/iR/importprodukt-orig/26e/26ebd7783335084369ac9a2ecc5c6e85--mmf350x350.jpg
