name,categories,price,rating,specification,image_link
Kondela Bulut,"['Bydlení a doplňky', 'Nábytek', 'Židle a stoličky', 'Konferenční židle']",650,100.0,Konferenční židle v jednoduchém moderním designu.,https://im9.cz/iR/importprodukt-orig/1fc/1fcfd0986caad7c0080a487ded487e59--mmf350x350.jpg
Manutan konferenční židle ISO,"['Bydlení a doplňky', 'Nábytek', 'Židle a stoličky', 'Konferenční židle']",1180,95.0,Čalouněné konferenční židle s povrchovou úpravou černou práškovou barvou vhodné do konferenčních a zasedacích místností. Zasedací židle jsou potaženy látkou v pěti možných barevných provedeních. Výhodou konferenčních křesel je jejich stohovatelnost do 10 ks. Nosnost jednací židle je 100 kg.,https://im9.cz/iR/importprodukt-orig/0b8/0b81a69d9a891ba8929f2eb7ec03cc1d--mmf350x350.jpg
Sedia 12 čalouněná židle,"['Bydlení a doplňky', 'Nábytek', 'Židle a stoličky', 'Konferenční židle']",1096,100.0,Provedení: Kovová konferenční židle je vyrobená v provedení kovové kostry s čalouněným sedákem a čalouněným opěradlem.,https://im9.cz/iR/importprodukt-orig/14a/14ad7ff7f8033ad4a7dbec91aa28bec2--mmf350x350.jpg
Antares konferenční židle Taurus Net,"['Bydlení a doplňky', 'Nábytek', 'Židle a stoličky', 'Konferenční židle']",1129,100.0,Židle TAURUS NET,https://im9.cz/iR/importprodukt-orig/0cb/0cb8e2cef62b6c89c3e3047f13a2a911--mmf350x350.jpg
LD Seating Oslo 225-KZ-N4,"['Bydlení a doplňky', 'Nábytek', 'Židle a stoličky', 'Konferenční židle']",5070,98.0,Konferenční židle celočalouněná.,https://im9.cz/iR/importprodukt-orig/7c4/7c44e5b2cf69089bfd03a1760c618cc1--mmf350x350.jpg
Antares konferenční židle Taurus PC ISO,"['Bydlení a doplňky', 'Nábytek', 'Židle a stoličky', 'Konferenční židle']",1128,100.0,Židle TAURUS PC ISO chrom,https://im9.cz/iR/importprodukt-orig/4e7/4e7e920c8d80454f9d5e9facfcf7370d--mmf350x350.jpg
Mayer Class 25C1 RS1/RP1,"['Bydlení a doplňky', 'Nábytek', 'Židle a stoličky', 'Konferenční židle']",2844,100.0,Židle CLASS 25C1,https://im9.cz/iR/importprodukt-orig/05f/05f3bfba3212794be1ae1ae9c33a81b6--mmf350x350.jpg
Kondela Rimala,"['Bydlení a doplňky', 'Nábytek', 'Židle a stoličky', 'Konferenční židle']",1350,89.0,Konferenční židle s opěrkami rukou v jednoduchém moderním designu.,https://im9.cz/iR/importprodukt-orig/4fd/4fd91d05c22e7e0fc4b21c7d402f2e54--mmf350x350.jpg
Biedrax LC9741 lavice do čekáren ISO,"['Bydlení a doplňky', 'Nábytek', 'Židle a stoličky', 'Konferenční židle']",8166,97.0,"Dřevěná lavice ISO II v provedení s černými kovovými nohami je skvělým vybavením do veřejných prostorů, hal či nejrůznějších typů čekáren. Jednotlivá místa k sezení jsou umístěna na ocelové konstrukci lavice a skládají se z dřevěných desek pro sedák i opěrák. Velkou výhodou dřevěné lavice je vysoká odolnost proti poškození a velmi snadná údržba včetně čištění. Konstrukce nabízí dvě místa k sezení a disponuje stabilní podstavou ve tvaru T. Nohy jsou u země zakončeny plastovými nástavci proti poškození podlahy. Nosnost jednoho místa dřevěné lavice je 100 kg a dodáváme ji s deskami v barvě buku. Dřevěnou lavici ISO II se dvěma místy k sezení dodáváme také v provedení s chromovanými nohami. Hlavní přednosti dřevěné lavice ISO II Dřevěná lavice ISO II nabízí široké spektrum využití Stabilní konstrukce poskytuje dvě místa k sezení Pohodlí zajistí dřevěné desky z buku Nosnost jednoho místa je 100 kg",https://im9.cz/iR/importprodukt-orig/083/0831deacbaaf2b249c98e379a3d594ad--mmf350x350.jpg
Office Pro jednací židle Calypso Meeting,"['Bydlení a doplňky', 'Nábytek', 'Židle a stoličky', 'Konferenční židle']",3146,100.0,POPIS,https://im9.cz/iR/importprodukt-orig/488/4881cd6af8aba67194553aa88ba9ad91--mmf350x350.jpg
"Antares Gala Net 1580 S -, kancelářská židle","['Bydlení a doplňky', 'Nábytek', 'Židle a stoličky', 'Konferenční židle']",5590,92.0, ,https://im9.cz/iR/importprodukt-orig/1f2/1f29f27b2c6d40093aa708d6beca1cfe--mmf350x350.jpg
Kondela ISO New,"['Bydlení a doplňky', 'Nábytek', 'Židle a stoličky', 'Konferenční židle']",1197,97.0,"Dřevěná židle ISO v provedení s černými nohami se vzhledem ke svému jednoduchému zpracování hodí téměř kamkoli. Skvěle ji využijete nejen v klasických kancelářích, ale i v zasedacích či konferenčních místnostech. Velkou výhodou těchto židlí je jejich stohovatelnost, tedy uložení několika židlí na sebe, což vám při uskladnění ušetří mnoho prostoru. Stohovat lze takto na sebe až 10 židlí. Židle je zkonstruována z oválných ocelových trubek. K těm jsou připevněny dřevěné desky pro sedák a opěru zad. Nohy jsou u země ukončeny plastovým nástavcem proti poškození podlahy. Nosnost dřevěné židle ISO je 100 kg a dodáváme ji s deskami v barvě buku. Dřevěnou židli ISO dodáváme také v provedení se šedými a chromovanými nohami. Hlavní přednosti dřevěné židle ISO Židle ISO nabízí široké spektrum využití Konstrukce je vyrobena z ocelových trubek Pohodlí zajistí dřevěné desky z buku Konferenční židli můžete stohovat až do 10 kusů Nosnost židle je až 100 kg",https://im9.cz/iR/importprodukt-orig/0b0/0b01840e581b2b2782aadf908db86c5b--mmf350x350.jpg
"Alba Smart čalouněná, stohovatelná","['Bydlení a doplňky', 'Nábytek', 'Židle a stoličky', 'Konferenční židle']",1935,97.0,Konferenční židle SMART čalouněná ,https://im9.cz/iR/importprodukt-orig/aa1/aa171bb2cde8fd8b695f5bd4ec3a0123--mmf350x350.jpg
Halmar židle ISO,"['Bydlení a doplňky', 'Nábytek', 'Židle a stoličky', 'Konferenční židle']",1390,92.0,židle ISO C-C11 černá,https://img-cdn.heureka.group/v1/8ad9fffa-fd4f-44ca-91b3-9db1e4bd916f.jpg?width=350&height=350
Antares 2170 C Rocky,"['Bydlení a doplňky', 'Nábytek', 'Židle a stoličky', 'Konferenční židle']",2567,,"Kancelářská židle Rocky 2170 Jedná se o moderní jednací židli, která je vybavena područkami a černě lakovaným rámem. Má čalouněný sedák a opěrák a je stohovatelná - max. 5 kusů.",https://im9.cz/iR/importprodukt-orig/055/05519b0e0a95a5cc202c63292252e3e7--mmf350x350.jpg
Kondela Azure 2 New Typ 2,"['Bydlení a doplňky', 'Nábytek', 'Židle a stoličky', 'Konferenční židle']",2421,,"Konferenční židle Azure 2 New 2, bílá",https://im9.cz/iR/importprodukt-orig/365/365ad754cd188b19b3a8539cac33776f--mmf350x350.jpg
Alba Olymp,"['Bydlení a doplňky', 'Nábytek', 'Židle a stoličky', 'Konferenční židle']",3960,100.0,Čalouněná konferenční židle OLYMP s područkami nejen do moderních kanceláří a poslucháren,https://im9.cz/iR/importprodukt-orig/222/222f10489adb3b9a437b6307d1284eca--mmf350x350.jpg
Alba konferenční křeslo Salma,"['Bydlení a doplňky', 'Nábytek', 'Židle a stoličky', 'Konferenční židle']",4414,88.0,Chromová konstrukce. Čalouněné. Výztuž opěráku. Područky potažené kůží.,https://im9.cz/iR/importprodukt-orig/7bd/7bd44242ce3b3de8517da845bf9aa0fb--mmf350x350.jpg
Mercury Pracovní židle PUR Work 3 CH03CS,"['Bydlení a doplňky', 'Nábytek', 'Židle a stoličky', 'Konferenční židle']",2990,93.0,Pracovní otočná židle Work 3,https://im9.cz/iR/importprodukt-orig/d35/d35403c2281c9a3829894560c082cbea--mmf350x350.jpg
Antares konferenční židle Taurus PN ISO,"['Bydlení a doplňky', 'Nábytek', 'Židle a stoličky', 'Konferenční židle']",958,100.0,"Stohovatené plastové židle ISO v několika barevných variantách. Chromovaný rám zajišťuje dlouhodobý estetický vzhled. Omyvatelný povrch usnadňuje dodržování hygienických podmínek. Vhodné jako školní, průmyslová či jídelní židle. Vnitřní i venkovní použití do 55 °C.,",https://im9.cz/iR/importprodukt-orig/059/0598cada784125a56f365991816acbac--mmf350x350.jpg
LD Seating Seance Care 070,"['Bydlení a doplňky', 'Nábytek', 'Židle a stoličky', 'Konferenční židle']",6449,100.0,"Konferenční celočalouněná židle je  stohovatelná,  s ocelovou kostrou se čtyřma nohama v barvě N1 černá nebo N2 hliník nebo N4 chrom s černými područkami. Série Seance Care je zaměřena na komfort a praktičnost. Seance Care zahrnuje univerzální a pohodlné konferenční a přísedící sezení určené pro řadu různě koncipovaných interiérů. Návštěvnické židl",https://im9.cz/iR/importprodukt-orig/6bc/6bcd8ee669951e4ea2cb482f5ecb2a00--mmf350x350.jpg
"Euroseat plastová lavice do čekáren Smile, 3-sedák + stolek","['Bydlení a doplňky', 'Nábytek', 'Židle a stoličky', 'Konferenční židle']",11587,96.0,,https://im9.cz/iR/importprodukt-orig/467/4674f3d3100e0962d7c952302f5b92c2--mmf350x350.jpg
Antares židle 1120 TC chrom,"['Bydlení a doplňky', 'Nábytek', 'Židle a stoličky', 'Konferenční židle']",1313,100.0,Židle 1120 TC,https://im9.cz/iR/importprodukt-orig/b22/b22be028fc38f569d52abdd07c3cedc7--mmf350x350.jpg
LD SEATING Židle THEO @ 262-KZ-N4,"['Bydlení a doplňky', 'Nábytek', 'Židle a stoličky', 'Konferenční židle']",4271,98.0,"Konferenční židle THEO 262-KZ-N4, chrom",https://im9.cz/iR/importprodukt-orig/98b/98b30fcb3e71cbadac606af6337c5758--mmf350x350.jpg
Kondela ISO,"['Bydlení a doplňky', 'Nábytek', 'Židle a stoličky', 'Konferenční židle']",1128,100.0,"Tato klasická jednací židle je vhodná do zasedacích nebo konferenčních místností, kanceláří, pracoven apod.  ",https://im9.cz/iR/importprodukt-orig/36a/36af27ba046f9b758f8f74d1f0c3c404--mmf350x350.jpg
Kondela lavice Helna,"['Bydlení a doplňky', 'Nábytek', 'Židle a stoličky', 'Konferenční židle']",4265,94.0,Moderní designová lavice v petrolejové barvě.,https://im9.cz/iR/importprodukt-orig/132/13282f26446ad3d59f4a7c173804df5f--mmf350x350.jpg
Kondela Ilham,"['Bydlení a doplňky', 'Nábytek', 'Židle a stoličky', 'Konferenční židle']",976,77.0,"Konferenční židle ILHAM, hnědá",https://im9.cz/iR/importprodukt-orig/a7a/a7a5db1a0e50e34aece7b4cdfdda28f7--mmf350x350.jpg
LD SEATING konferenční židle DREAM 130-Z-N1,"['Bydlení a doplňky', 'Nábytek', 'Židle a stoličky', 'Konferenční židle']",3957,100.0,"Konferenční židle DREAM 130-Z-N1,BR, kostra černá",https://im9.cz/iR/importprodukt-orig/d66/d66918201a547a210a5bddf0b37bd80b--mmf350x350.jpg
Antares Konferenční židle Strike PC,"['Bydlení a doplňky', 'Nábytek', 'Židle a stoličky', 'Konferenční židle']",1690,92.0,Konferenční židle Strike PC,https://im9.cz/iR/importprodukt-orig/8e6/8e68c5f0e3c8601b2fc15712ea233fc1--mmf350x350.jpg
Goleto vintage toaletní stolička bílá,"['Bydlení a doplňky', 'Nábytek', 'Židle a stoličky', 'Stoličky']",490,97.0,Originální vintage toaletní stolička bílá,https://im9.cz/iR/importprodukt-orig/a20/a20c8e619d792d9d4addd48661b632c4--mmf350x350.jpg
Topex 79R319,"['Bydlení a doplňky', 'Nábytek', 'Židle a stoličky', 'Stoličky']",299,99.0,"Skládací nášlapná stolička TOPEX s nosností 150 kg. Praktická skládací nášlapná stolička o výšce 22 cm z odolného plastu. Lze jí využít jako plošinu. Vyznačuje se promyšleným skládacím mechanismem, díky kterému je stabilní a její použití je bezpečné. Po složení zabírá málo místa.",https://im9.cz/iR/importprodukt-orig/e72/e72e10fc8f386a2fb2a984f2fac19c48--mmf350x350.jpg
TORO Skládací stolička zelená,"['Bydlení a doplňky', 'Nábytek', 'Židle a stoličky', 'Stoličky']",299,98.0,Skládací stolička z pevného plastu. Vysoce odolná a stabilní. Maximální nosnost 150kg. Protiskluzové prvky na nohou i na vrchní ploše. Rozměr stoličky: 29cm x 22cm x 22cm. Rozměry ve složeném stavu 33cm x 29cm x 4cm.  ,https://im9.cz/iR/importprodukt-orig/186/186aec40566b683eba4dad9997b59cd0--mmf350x350.jpg
KidKraft Step bílá,"['Bydlení a doplňky', 'Nábytek', 'Židle a stoličky', 'Stoličky']",789,96.0,KidKraft dřevěná stolička bílá,https://im9.cz/iR/importprodukt-orig/0eb/0eb1824523816f7a2f5e10c0c804255d--mmf350x350.jpg
KEEEPER 53995124 dvojschůdek 40 x 37 x 21 cm krémová,"['Bydlení a doplňky', 'Nábytek', 'Židle a stoličky', 'Stoličky']",229,96.0,Plastová stolička nebo dvojschůdek o nosnosti 120 kg je praktický pomocník do domácnosti. Rozměr: 40 x 37 x 21 cm.,https://im9.cz/iR/importprodukt-orig/29e/29e4e5f29ca7ad382321ae56237c39fc--mmf350x350.jpg
Heidrun Stolička 43x34x42cm,"['Bydlení a doplňky', 'Nábytek', 'Židle a stoličky', 'Stoličky']",207,96.0,"Plastová stolička s širokým využitím pro práci na zahradě, v dílně i v domácnosti.",https://im9.cz/iR/importprodukt-orig/371/3716d05e34e58f94195a9d85f637c763--mmf350x350.jpg
HomeLife BG-S-1010 40x23x15 cm,"['Bydlení a doplňky', 'Nábytek', 'Židle a stoličky', 'Stoličky']",499,97.0,Pomocný schůdek,https://im9.cz/iR/importprodukt-orig/62b/62b7e17eb7feb79afcc7dac0d0143ed4--mmf350x350.jpg
Zulu Outdoor Truno černá,"['Bydlení a doplňky', 'Nábytek', 'Židle a stoličky', 'Stoličky']",149,99.0,"Nízká hmotnost a malé rozměry po sbalení, to jsou hlavní přednosti lehkého skládacího sedátka Truno od firmy Zulu. Ocelová konstrukce ošetřená práškovým lakem i polyesterový potah jsou natolik odolné, že snesou zatížení až 100 kg. Stoličku si jistě oblíbí zejména vodáci či nenároční kempaři, kteří musí zabalit svou letní domácnost do batohu.",https://im9.cz/iR/importprodukt-orig/ce9/ce971c76068b2a9371024e50d320a369--mmf350x350.jpg
KIK KX4404,"['Bydlení a doplňky', 'Nábytek', 'Židle a stoličky', 'Stoličky']",286,96.0,PROTISKLUZOVÁ SKLÁDACÍ STOLIČKA VYSOKÁ 39 CM ČERNÁ,https://im9.cz/iR/importprodukt-orig/211/2113fd1ef85c12c56569319cd0b64d58--mmf350x350.jpg
"M.A.T. GROUP 28,5 x 21 x 22cm zelená","['Bydlení a doplňky', 'Nábytek', 'Židle a stoličky', 'Stoličky']",117,97.0,Skládací stolička,https://im9.cz/iR/importprodukt-orig/a8f/a8f37d212f28373f302ad813db76ac50--mmf350x350.jpg
Goleto vintage toaletní stolička bílá,"['Bydlení a doplňky', 'Nábytek', 'Židle a stoličky', 'Stoličky']",490,97.0,Originální vintage toaletní stolička bílá,https://im9.cz/iR/importprodukt-orig/a20/a20c8e619d792d9d4addd48661b632c4--mmf350x350.jpg
Drewmax KT254 přírodní,"['Bydlení a doplňky', 'Nábytek', 'Židle a stoličky', 'Stoličky']",350,95.0,Dřevěný taburet stolička z bukového masivu Drewmax KT254,https://im9.cz/iR/importprodukt-orig/39f/39f559666ce060b822ebfbb4ab04b5fc--mmf350x350.jpg
Tontarelli Stolička U.T.C,"['Bydlení a doplňky', 'Nábytek', 'Židle a stoličky', 'Stoličky']",248,98.0,"Plánujete zakoupení dalšího místa k sezení či jen stylový kousek do vašeho interiéru? Tontarelli Stolička Dumbo LARGE šedá pro vás bude tou pravou volbou. Najdete pro ni místo i v malé místnosti, její rozměry jsou pouze 24 × 38 × 30 cm. Na konstrukci se používá plast. Aby se vám na stoličce příjemně sedělo, musíte znát i materiál sedáku. Na tento model se používá plast. Elegantní vzhled stoličky Tontarelli tvoří šedá. Při její koupi je důležité myslet i na to, že disponuje nosností 150 kg. V balení najdete jednu stoličku. Stolička Tontarelli nabízí hmotnost 2 kg. Stěžejní vlastnosti produktu Tontarelli Stolička Dumbo LARGE šedá Pořiďte si zajímavou stoličku Vyrábí se s výškou sedu 24 cm Rozměry: 38 × 30 cm Stoličce Tontarelli patří šedá barva Na konstrukci se používá materiál, jímž je plast Pro výrobu sedáku poslouží plast Hmotnost stoličky Tontarelli činí 2 kg Do balení se dává jedna stoličku Myslete také na její nosnost 150 kg",https://im9.cz/iR/importprodukt-orig/53a/53aacdbd9367e55f97b2b9027f026f1d--mmf350x350.jpg
"Stolička Skotnica Skotnica, černá, polstr, 4 nohy","['Bydlení a doplňky', 'Nábytek', 'Židle a stoličky', 'Stoličky']",2590,97.0,"Kvalitní masivní židle SKOTNICA české výroby.  použité dřevo - jasan, buk  Matice použitá v podvozku židle je litinová , šroub na sedáku je ocelový. Nehrozí tedy stržení závitu jako tomu je u čínských židlí.  Výškově nastavitelná 45-65 cm  Průměr sedáku 32 cm",https://img-cdn.heureka.group/v1/94e72096-044c-4bf4-af31-40755f8cc55d.jpg?width=350&height=350
PHYSIONICS CASARIA výškově nastavitelná otočná s opěradlem bílá,"['Bydlení a doplňky', 'Nábytek', 'Židle a stoličky', 'Stoličky']",1247,92.0,"Otočná židle s opěradlem nabízí komfort sezení a velkou flexibilitu. Je plynule výškově nastavitelná a volně otočná o 360°. Má také pochromovanou ocelovou základnu s 5 kolečky pro optimální stabilitu. Podsedák o tloušťce 10 cm a plynová pružina zajišťují optimální komfort sezení. Potah sedačky je vyroben z umělé kůže, která se snadno udržuje a je odolná. To znamená, že hladký povrch lze rychle a jednoduše vyčistit.",https://im9.cz/iR/importprodukt-orig/ac0/ac0ae33938b803254bff1b9fae5b8f39--mmf350x350.jpg
Divero 6142 suar,"['Bydlení a doplňky', 'Nábytek', 'Židle a stoličky', 'Stoličky']",1351,97.0,"Moderní stolička ze dřeva SUAR (dub asijský) se zakřiveným sedadlem se stane designovým pokladem Vašeho domova. Stolička je přes svou masivnost velice elegantní a stane se funkčním doplňkem jakéhokoli Vašeho pokoje, zimní zahrady nebo venkovního altánu.",https://im9.cz/iR/importprodukt-orig/0aa/0aaf1afc12f9163702733802e2d1049f--mmf350x350.jpg
Fala TO-75916 30x20x21 cm oranžová,"['Bydlení a doplňky', 'Nábytek', 'Židle a stoličky', 'Stoličky']",162,92.0,"Stolička je vyrobena z odolného polypropylenu, je vybavena sedátkem s protiskluzným povrchem.",https://im9.cz/iR/importprodukt-orig/529/5293fac3c2276aca791e281d22813ebd--mmf350x350.jpg
Zopa Dvojstupínek Unicorn šedý / růžový,"['Bydlení a doplňky', 'Nábytek', 'Židle a stoličky', 'Stoličky']",329,97.0,Dvojstupínek pro malé děti k umyvadlu a k WC s protiskluzovou úpravou pomáhá bezpečně si osvojovat základní hygienické návyky.,https://im9.cz/iR/importprodukt-orig/7fe/7fef1a1e19df53553ea30b5e2689e0dc--mmf350x350.jpg
Rojaplast Tirolo drevo,"['Bydlení a doplňky', 'Nábytek', 'Židle a stoličky', 'Stoličky']",229,98.0,"Dřevěná stolička, která najde využití v každé domácnosti. Vyrobena z borovicového dřeva. Přírodní provedení umožňuje stoličku natřít a ošetřit dle vlastní představy. S nosností 100 kg poslouží nejen jako stolička, ale i jako schůdek pro dosažení do vyšších míst. Certifikát FSC zaručuje, že použité dřevo pochází ze šetrně obhospodařovaných lesů, ve kterých jsou dodržovány přísné ekologické a sociální požadavky.",https://im9.cz/iR/importprodukt-orig/104/1041302a511a61793bb9f5b311bda111--mmf350x350.jpg
Zulu Truno 2022 Barva: modrá,"['Bydlení a doplňky', 'Nábytek', 'Židle a stoličky', 'Stoličky']",149,99.0,"Chcete-li ušetřit místo v batohu a nesedět například večer při táboráku na provlhlé zemi, tak právě pro vás značka Zulu připravila lehkou skládací stoličku Truno. Nízká hmotnost a malé rozměry po sbalení, to jsou hlavní přednosti lehkého skládacího sedátka Truno od firmy Zulu. Ocelová konstrukce ošetřená práškovým lakem i polyesterový potah jsou natolik odolné, že snesou zatížení až 100 kg. Stoličku si jistě oblíbí zejména vodáci či nenároční kempaři, kteří musí zabalit svou letní domácnost do batohu.",https://im9.cz/iR/importprodukt-orig/1b8/1b8a9d3e97fe4ee682d7f200849b7379--mmf350x350.jpg
OKT Stupínek k umyvadlu a WC HIPPO Zelený,"['Bydlení a doplňky', 'Nábytek', 'Židle a stoličky', 'Stoličky']",219,95.0,Stupínek pro malé děti k umyvadlu a WC s protiskluzovou úpravou. Protiskluzová ochrana podnoží pro stabilitu stoličky. S protiskluzovou ochranou na povrchu; snižuje riziko uklouznutí. Maximální hmotnost zátěže: 50 Kg,https://im9.cz/iR/importprodukt-orig/057/05705190f5f11c5fee89b2d8b7687544--mmf350x350.jpg
Caperlan Essenseat 100 Compact,"['Bydlení a doplňky', 'Nábytek', 'Židle a stoličky', 'Stoličky']",279,97.0,Pevná stolička vhodná na všechny outdoorové aktivity. Je odolá vůči korozi.,https://im9.cz/iR/importprodukt-orig/ab2/ab274f2a9f2275f8e5e823bcc64d4adf--mmf350x350.jpg
Orion 812106 stupínek bílý / modrý,"['Bydlení a doplňky', 'Nábytek', 'Židle a stoličky', 'Stoličky']",199,95.0,Stupínek / stolička má všestranné použití.,https://im9.cz/iR/importprodukt-orig/11f/11feafd18bd6cbe28722ec066c812b07--mmf350x350.jpg
Drewmax KT248 olše,"['Bydlení a doplňky', 'Nábytek', 'Židle a stoličky', 'Stoličky']",581,95.0,Dřevěná borovicová stolička - taburet 248001,https://im9.cz/iR/importprodukt-orig/408/4088dce9319b97c252d1568c550b050b--mmf350x350.jpg
Keeeper dvojstupínek Frozen,"['Bydlení a doplňky', 'Nábytek', 'Židle a stoličky', 'Stoličky']",429,97.0,"Dvojstupínek k WC/umyvadlu je praktické sedátko/stupátko, které dětem pomáhá bezpečně si osvojovat základní hygienické návyky. •  Vhodné k využití v koupelně či na toaletě, kdy dětem usnadní přístup k těžce dostupným místům •  Protiskluzová úprava na spodní i vrchní straně stoličky •  Z odolného materiálu, který se snadno udržuje",https://im9.cz/iR/importprodukt-orig/943/943d318f231ce1c16e1aa560ca247921--mmf350x350.jpg
Adodo 086,"['Bydlení a doplňky', 'Nábytek', 'Židle a stoličky', 'Stoličky']",199,,"Tato stolička má klasický venkovský design, takže zapadne do jakéhokoliv interiéru. Je vyrobena z masivního borovicového dřeva a není opatřena žádnou povrchovou úpravou. Díky tomu ji lze přetřít bezbarvým či jiným lakem. Její uplatnění v domácnosti je velice rozsáhlé. Můžete ji použít jako sedátko do dětského pokoje, stojan pro květiny nebo vám umožní dosáhnout i těžko dostupných míst. Stolička navíc obsahuje praktickou rukojeť pro snazší přenášení.",https://im9.cz/iR/importprodukt-orig/133/133f963acb1a9530621b3caf6b3d6b4c--mmf350x350.jpg
Hatu Dětská plastová Panda bílá 296 x 205 x 26 cm,"['Bydlení a doplňky', 'Nábytek', 'Židle a stoličky', 'Stoličky']",149,96.0,"﻿Veselá plastová dětská židlička v designu medvídka pandy. I vaše dítko se může pohodlně usadit a relaxovat. Židlička je vyrobená z plastu, který je charakteristický svou vysokou pevností a snadnou údržbou. Plast se vyznačuje také snadnou skladovatelností. Určeno pro děti ve věku 1-3 let.",https://im9.cz/iR/importprodukt-orig/77d/77da43c23393b0c059b0e2a3b4b98717--mmf350x350.jpg
Keeeper Protiskluzový dvojstupínek stars bílá,"['Bydlení a doplňky', 'Nábytek', 'Židle a stoličky', 'Stoličky']",322,91.0, ,https://im9.cz/iR/importprodukt-orig/123/123072450617462d3e591828e8b919b6--mmf350x350.jpg
Keeeper Hippo dvojstupínek bílý,"['Bydlení a doplňky', 'Nábytek', 'Židle a stoličky', 'Stoličky']",335,98.0,Upozornění! Aktuálně máme na skladě pouze fialového hrocha s šedým protiskluzovým lemováním kolem produktu!,https://im9.cz/iR/importprodukt-orig/1a3/1a361a2766428d5525bab00b52f0eec2--mmf350x350.jpg
"Rotho 43 x 35,8 x 23,8 cm černá","['Bydlení a doplňky', 'Nábytek', 'Židle a stoličky', 'Stoličky']",239,98.0,"Praktická plastová stolička. Odolný a pevný materiál. Široké patky s integrovanými protiskluzovými nožičkami. Kvalitní zpracování od švýcarské značky ROTHO. Tato stolička najde uplatnění v každé domácnosti.Technické údaje:rozměr výrobku: 43 x 35,8 x 23,8 cm (d x š x v)materiál: plastbarva: černánosnost do: 150 kghmotnost: 0,81 kgObsah balení:1 x Stolička ROTHO",https://im9.cz/iR/importprodukt-orig/4c7/4c783ab4a4899cb05ab57f971bf47afa--mmf350x350.jpg
Zopa Loostep Ice zelený,"['Bydlení a doplňky', 'Nábytek', 'Židle a stoličky', 'Stoličky']",849,97.0,Nastavitelné schůdky na WC s anatomicky tvarovaným sedákem pro děti.  ,https://im9.cz/iR/importprodukt-orig/7d0/7d0fe0354a34f818c7454d95c4da7432--mmf350x350.jpg
Keeeper dvojschůdek Farma zelený,"['Bydlení a doplňky', 'Nábytek', 'Židle a stoličky', 'Stoličky']",317,95.0,Stolička dvoustuňový s protiskluzovou úpravouí Funny Farm. Kolekce:Funny Farm. Barva:zelená. Rozměry: cca 40 x 37 x 21cm.,https://im9.cz/iR/importprodukt-orig/0e8/0e883fd85efdfbe903465c7637d73ce8--mmf350x350.jpg
Solarton ST 01 N,"['Bydlení a doplňky', 'Nábytek', 'Židle a stoličky', 'Stoličky']",1990,100.0,"Solarton ST-01 N je otočná stolička s kovovou kontrukcí a měkkým polstrovaným sedákem. Je výškově stavitelná v rozsahu 45 - 60 cm. Sedák je černý prošívaný z černé koženky a dostatečně polstrovaný pro pohodlný, ale stabilní posez. Je vhodná pro všechny klávesy a digitální piana.",https://im9.cz/iR/importprodukt-orig/58e/58eb7ec66f2938f177e24f4baa8592be--mmf350x350.jpg
